text,scraped_at,source
"🚨 America Pay Attention to South Carolina Just because Trump endorses someone does not mean he knows what is best for your state. Let’s be honest, we all know how terrible Lindsey Graham is and has been for America. Mark Lynch is the real deal. I’ve met him and know him to",2026-04-11 07:05:37,@annvandersteel
🚨US-IRAN TALKS IN ISLAMABAD – Historic High-Level Meeting Underway Today marks the highest-level direct negotiations between the US and Iran since the 1979 Islamic Revolution — and the first official face-to-face talks since the 2015 nuclear deal. Key Updates: - Iranian,2026-04-11 07:05:37,@EmmanuelInvest
"Iranians have held nationwide rallies marking the 40th day of mourning for former leader Ali Khamenei, condemning US-Israel strikes and opposing planned diplomatic talks abroad. #Iran #Khamenei #MiddleEast #GlobalPolitics #BreakingNews #MiTVPlus",2026-04-11 07:05:37,@mitvplus_ng
"🚨🇵🇰🇺🇸 JD Vance’s arrival for peace talks with Iran: Pakistan's Field Marshal Syed Asim Munir, FM Ishaq Dar, and Mohsin Naqvi welcomed the U.S. Vice President with warm smiles in Islamabad. #IslamabadTalks",2026-04-11 07:05:36,@Saeedullahpak
No Deal With Terrorists Rulling Iran! #KingRezaPahlaviForIran #DigitalBlackOutIran,2026-04-11 07:05:36,@Azadeh_Kad
"Everyone's watching AI stocks, but the real action next week is in energy infrastructure 🔥 With oil at $96 and US-Iran talks starting, pipeline companies like $KMI are trading at 8x EBITDA while tech sits at 25x. Energy transport becomes critical regardless of who wins",2026-04-11 07:05:33,@Le_Kousou
"🐋 WHALE ALERT $9,803 BUY on Yes ""Will Mojtaba Khamenei be head of state in Iran end of 2026?"" @ $0.60 Market: Trader:",2026-04-11 07:05:32,@WhaleAlertPoly
"For 10 LONG YEARS, I've been SCREAMING and YELLING about TRUMP! I KNEW, as soon as the GOP chose him, that we were FUCKED! I'll NEVER understand why so many didn't SEE it! He's done everything I feared, and WORSE! He and the GOP are TERRORISTS! They all must GO! Art2Sec4!",2026-04-11 07:05:32,@Michell33650674
"#Kashan_Bridge, which was damaged by American-Israeli missiles, was repaired in three days. This is Iranian and our knowledge is indigenous because we were not subjected to domination and were not dependent!",2026-04-11 07:05:31,@highlighter100
USA 🇺🇸 delegation led by their Vice President has reached Pakistan 🇵🇰 for crucial talks with Iran 🇮🇷 #IslamabadTalks,2026-04-11 07:05:30,@anwarptvnews
Do you stand with Iran..?🇮🇷 Drop yes and RT this post if you are supporting Iran🇮🇷,2026-04-11 07:05:30,@MalixNaina56209
"PRESIDENT TRUMP HAS ALREADY CHALKED UP A LOT OF WINS FOR AMERICA, THE DEEP STATE GLOBALIST COMMIES WORK 24/7 PROPAGANDIZING TO THE UNDERINFORMED AND WEAK WILLED LEFTISTS, WHO VOTE AGAINST REASON AND THEOR OWN BEST INTERESTS OUT OF OPPOSITIONAL BITTERNESS AND ENVY. SAVE AMERICA.",2026-04-11 07:05:30,@WinningPres45
"JD Vance has landed in Pakistan. This time, Asim Munir is wearing a suit while welcoming him; previously, he wore a military uniform when welcoming the Iranian delegation.",2026-04-11 07:05:30,@Wakhaan_Times
And this is why Israel and the United States cannot win in any war against #Iran. The people are not afraid to do whatever it takes to protect their country. #Irán 🇮🇷 #Russia 🇷🇺 #China 🇨🇳 #NorthKorea 🇰🇵 #Pakistán 🇵🇰 #viral #trending #EpsteinFiles #IranWar #FAFO #TheReapersAwait,2026-04-11 07:05:29,@djcrushkd
"The so called ""Feild Marshal"" is enabled and supported by the US, to do their bidding within the country and in the region. Like when they got stuck in the war with Iran, and had no way out... the ""Feild Marshal"" got them their peace talks.",2026-04-11 07:05:29,@MrEhtisham96
The astonishing multimillion-dollar rescue mission in Iran.,2026-04-11 07:05:28,@KeepingKen
🚨 EXPLOSIVE: Sacked TN Congress women leader drops serious allegations on Alka Lamba: — Harassment led to her resignation — Misuse of membership funds for “LUXURY” — Questions over AIMC account transparency — Threatens FIR over alleged financial irregularities BIG STORY.,2026-04-11 07:05:26,@Indian_Analyzer
"I see Trump is being very obedient, he’s a good little boy and always does as he’s told by his master Netanyahu. Awww",2026-04-11 07:05:26,@DonnaChauhan
"These high-stakes US-Iran negotiations in Islamabad are doomed before they even begin. You simply cannot negotiate with terrorists, and the Islamic fascists who rule Iran have proven themselves fundamentally untrustworthy time and again. Their regime has spent decades funding",2026-04-11 07:05:25,@SMUMustangAlum
#BREAKING 🔹 🇵🇰 Pakistan's army chief General Asim Munir and Foreign Minister Ishaq Dar warmly welcome the high-level Iranian delegation led by Speaker Bagher Ghalibaf and FM Abbas Araghchi in Islamabad. #USIranTalks #IslamabadTalks #Pakistán,2026-04-11 07:05:24,@TwilightDewy
Iran ceasefire talks one saying fits best beggars are not choosers. US who is searching for dignified exit but Trump posing with threats to Iran. Iran too looking for dignified exit too with permanent solution to this problem for their existence. Both are beggars and choosers too,2026-04-11 07:05:23,@S01525868
Iran and women’s right in the same sentence 😭🤣,2026-04-11 07:05:23,@oghenekevebaby
Well are you really okay with this?? Look how bad this makes us look Johnson City……and you CENSURE him?! And why did he mention that pedophile Trump? Looking for favors?? Sickening!,2026-04-11 07:05:22,@kwmcconnell
